video_id,title,published_date
yhTipwdwe9w,Fun fact about JavaScript,2025-12-11T12:52:21Z
kRv2ElPNAdY,Code 7 Landmark NLP Papers in PyTorch (Full NMT Course),2025-12-10T14:42:03Z
fLnkVdDPgso,How to split a string in Python,2025-12-10T13:29:24Z
9kKNFP9srjc,So how do closures work again...?,2025-12-09T13:05:16Z
BMt-qvrEcFY,Build Serverless AI Agents with Langbase,2025-12-08T14:25:10Z
VgBQ0yBSjfM,How to build your own learning path using Open Source with Kunal Kushwaha [Podcast #200],2025-12-05T13:45:05Z
mAFoROnOfHs,Git &amp; GitHub Crash Course for Beginners [2026],2025-12-04T16:19:42Z
wu8npoU37cI,"Become an AI Researcher Course – LLM, Math, PyTorch, Neural Networks, Transformers",2025-12-03T14:28:01Z
KOutPbKc9UM,Intro to Backend Web Development – Node.js &amp; Express Tutorial for Beginners,2025-11-17T14:00:36Z
